leelaz_opencl_tuning
0;XgemmBatched;256;125;256;36; -DKWG=32 -DKWI=8 -DMDIMA=8 -DMDIMC=8 -DMWG=32 -DNDIMB=8 -DNDIMC=8 -DNWG=32 -DSA=1 -DSB=1 -DSTRM=0 -DSTRN=0 -DTCE=0 -DVWM=4 -DVWN=4;OpenCL: NVIDIA Corporation Tesla P100-PCIE-16GB @ 1328MHz

